{
  "schemaVersion": 1,
  "truthId": "task-settings-207.pet-monkey-family",
  "status": "verified",
  "taskId": "TASK-SETTINGS-207",
  "sources": [
    {
      "id": "pet-monkey-1",
      "file": "local-resources/regima/legacy-extraction/resources_by_swf/[172845].swf/scripts/export/pet/PetMonkey1.as",
      "sha256": "bc82b14bd316389841fe2267f4382354fae820a56fa0c868a2fa62aa80cb20dd"
    },
    {
      "id": "pet-monkey-2",
      "file": "local-resources/regima/legacy-extraction/resources_by_swf/[172845].swf/scripts/export/pet/PetMonkey2.as",
      "sha256": "855283fddf3f988f0848460fc304d1802e2a8d83e3aa89b813281cc608afaa43"
    },
    {
      "id": "pet-monkey-3",
      "file": "local-resources/regima/legacy-extraction/resources_by_swf/[172845].swf/scripts/export/pet/PetMonkey3.as",
      "sha256": "4ad78699aebbfbc78e9be70f09bde8e434d8d3eee513a5338d3e906cde0d6bdc"
    },
    {
      "id": "pet-monkey-4",
      "file": "local-resources/regima/legacy-extraction/resources_by_swf/[172845].swf/scripts/export/pet/PetMonkey4.as",
      "sha256": "9c81aa42be60053ca202f8519ce905a1cf40f2060597569fbea5096cb936e72e"
    },
    {
      "id": "base-pet",
      "file": "local-resources/regima/legacy-extraction/resources_by_swf/[172845].swf/scripts/base/BasePet.as",
      "sha256": "29445a84725a475a69d4a779eec57d488a2288a306ae7555e8ce8f5abd622c42"
    },
    {
      "id": "base-bullet",
      "file": "local-resources/regima/legacy-extraction/resources_by_swf/[172845].swf/scripts/base/BaseBullet.as",
      "sha256": "70ebadf7758400170bca4991053954863d9872cd04ea293dd286534796e32e96"
    },
    {
      "id": "pet-info",
      "file": "local-resources/regima/legacy-extraction/resources_by_swf/[172845].swf/scripts/petInfo/PetInfo.as",
      "sha256": "b9bba062ed38c9e475bb4e1b29dfc2328ba968453ed8d2fe821a403eb4b4dbc2"
    },
    {
      "id": "collision-owner",
      "file": "local-resources/regima/source/restored-swfs/assets/StageCommon.swf",
      "sha256": "c6fc973d7d606ce4ea177b0ac075844c86a5ee7e493235fa812a029fbe4f29c9"
    },
    {
      "id": "visual-truth",
      "file": "docs/reverse-engineering/ground-truth/manifests/task-settings-193a-pet-monkey-animation.json",
      "sha256": "0541f6bab5cf572c5c58180a84633a8e2517d0ba9643323c83f5937ea0d43b80"
    }
  ],
  "visualTruth": {
    "manifest": "docs/reverse-engineering/ground-truth/manifests/task-settings-193a-pet-monkey-animation.json",
    "truthId": "task-settings-193a.pet-monkey-animation",
    "stateCount": 626,
    "displayObjectCount": 20,
    "baselineCount": 626,
    "unresolvedCount": 0,
    "role": "逐对象、逐方向、逐动作、逐关键帧视觉与命中发射点的唯一原版机器真值"
  },
  "owners": [
    {
      "form": "monkey1",
      "bodyClass": "PetMonkeyBmd1",
      "bodyOwner": "assets/20120203.swf",
      "collisionClass": "ObjectBaseSprite3",
      "collisionCharacterId": 103
    },
    {
      "form": "monkey2",
      "bodyClass": "PetMonkeyBmd2",
      "bodyOwner": "assets/20120203.swf",
      "collisionClass": "ObjectBaseSprite4",
      "collisionCharacterId": 101
    },
    {
      "form": "monkey3",
      "bodyClass": "PetMonkeyBmd3",
      "bodyOwner": "assets/20120203.swf",
      "collisionClass": "ObjectBaseSprite",
      "collisionCharacterId": 105
    },
    {
      "form": "monkey4",
      "bodyClass": "PetMonkeyBmd4",
      "bodyOwner": "assets/pet1.swf",
      "collisionClass": "ObjectBaseSprite",
      "collisionCharacterId": 105
    }
  ],
  "sharedRuntime": {
    "updateOrder": [
      "projectile-step",
      "passive",
      "ai",
      "passive-upgrade",
      "cooldown-decrement",
      "time-count",
      "owner-warp",
      "base-step"
    ],
    "targeting": {
      "source": "gc.obbsiteArray = gc.pWorld.monsterArray",
      "selection": "first element within distance <= 1200",
      "order": "stable monster insertion/spawn order",
      "loss": "dead or distance >= 1200 clears target without same-frame reselection"
    },
    "cadence": {
      "aiActionCheck": "once per frameClips interval",
      "decisionPriority": [
        "skill1",
        "skill2",
        "skill3",
        "skill4",
        "once-per-second attack/follow branch"
      ],
      "normalBranch": "random <= 0.7 => normal; otherwise new random < 0.3 => wait; otherwise follow target"
    },
    "movement": {
      "ownerFollowRange": 640,
      "targetSearchRange": 1200,
      "warpDistance": 1000,
      "warpDestination": "owner.x, owner.y - 30"
    },
    "cooldown": "AI reads current CD first; countSkillCD decrements positive slots afterward",
    "hurt": "reduceHp applies defense/hurt processing; monkey override sets hurt-release trigger after super.reduceHp, including a lethal hit; death phase still wins",
    "projectile": "hero/pet bullets scan monsterArray.concat(likeMonsterArray), de-duplicate by attackId, call target.beMagicAttack, and respect hitMaxCount/attackInterval",
    "damage": "bullet snapshots source getRealPower(curAction); BasePet real power is atk * 2.8, then target defense/countHurt/reduceHp apply",
    "death": "HP <= 0 sets dead; single mode decrements life; otherwise death/hurt body action resolves",
    "destroy": "destroy body/effects, mark destroyed, fade/remove after one second, destroy all bullets, clear owner pet slot and protected references",
    "locators": [
      {
        "file": "local-resources/regima/legacy-extraction/resources_by_swf/[172845].swf/scripts/base/BasePet.as",
        "lines": "141-215,305-397,566-746,865-934,1009-1043,1075-1086,1150-1189"
      },
      {
        "file": "local-resources/regima/legacy-extraction/resources_by_swf/[172845].swf/scripts/base/BaseBullet.as",
        "lines": "105-133,225-371,382,427-461,486-496,554-557"
      }
    ]
  },
  "forms": [
    {
      "id": "monkey1",
      "speed": 5,
      "attackRate": 0.7,
      "attackRange": 40,
      "collision": "ObjectBaseSprite3",
      "skills": [
        {
          "id": "xj",
          "slot": 1,
          "initialCdSeconds": 2,
          "intervalCdSeconds": 3,
          "mp": 20,
          "hit": "hit2",
          "formula": "(2.6 * atk * 1.05 + magicAdd) * crit(1|2) * GXP(1|1.2)",
          "release": "learned && mp && hurtRelease"
        }
      ],
      "actions": {
        "normal": {
          "hit": "hit1",
          "frameCount": 10,
          "emit": {
            "x": "direction * 45",
            "y": -25
          },
          "projectile": "PetMonkey1Bullet1"
        },
        "xj": {
          "hit": "hit2",
          "frameCount": 11,
          "emit": {
            "x": "direction * 45",
            "y": -80
          },
          "projectile": "PetMonkey1Bullet2",
          "followsPet": true,
          "lifetimeSeconds": 4,
          "clearsHurtRelease": true
        }
      }
    },
    {
      "id": "monkey2",
      "speed": 5,
      "attackRate": 0.7,
      "attackRange": 70,
      "collision": "ObjectBaseSprite4",
      "skills": [
        {
          "id": "lj",
          "slot": 1,
          "initialCdSeconds": 2,
          "intervalCdSeconds": 3,
          "mp": 20,
          "hit": "hit2",
          "formula": "(4.2 * atk * 1.05 + magicAdd) * crit(1|2) * GXP(1|1.2)",
          "release": "learned && mp"
        },
        {
          "id": "xj",
          "slot": 2,
          "initialCdSeconds": 2,
          "intervalCdSeconds": 7,
          "mp": 20,
          "hit": "hit3",
          "formula": "(2.6 * atk * 1.05 + magicAdd) * crit(1|2) * GXP(1|1.2)",
          "release": "learned && mp && hurtRelease"
        }
      ],
      "actions": {
        "normal": {
          "hit": "hit1",
          "frameCount": 8,
          "emit": {
            "x": "direction * 65",
            "y": -30
          },
          "projectile": "PetMonkey2Bullet1"
        },
        "lj": {
          "hit": "hit2",
          "frameCount": 1,
          "prelude": {
            "projectile": "PetMonkey2Bullet2_1",
            "disabled": true,
            "behindPet": true,
            "x": "direction * 15",
            "y": -15
          },
          "damage": {
            "projectile": "PetMonkey2Bullet2_2",
            "x": 0,
            "y": 0
          }
        },
        "xj": {
          "hit": "hit3",
          "frameCount": 10,
          "emit": {
            "x": "direction * 45",
            "y": -70
          },
          "projectile": "PetMonkey1Bullet2",
          "followsPet": true,
          "lifetimeSeconds": 4,
          "clearsHurtRelease": true
        }
      }
    },
    {
      "id": "monkey3",
      "speed": 5,
      "attackRate": 0.7,
      "attackRange": 150,
      "collision": "ObjectBaseSprite",
      "skills": [
        {
          "id": "lyq",
          "slot": 1,
          "initialCdSeconds": 2,
          "intervalCdSeconds": 3,
          "mp": 20,
          "hit": "hit2",
          "formula": "(6.8 * atk * 1.05 + magicAdd) * crit(1|2) * GXP(1|1.2)",
          "release": "learned && mp && targetDistance <= 400"
        },
        {
          "id": "xj",
          "slot": 2,
          "initialCdSeconds": 2,
          "intervalCdSeconds": 7,
          "mp": 20,
          "hit": "hit3",
          "formula": "(2.6 * atk * 1.05) * GXP(1|1.2)",
          "release": "learned && mp"
        },
        {
          "id": "lj",
          "slot": 3,
          "initialCdSeconds": 4,
          "intervalCdSeconds": 9,
          "mp": 20,
          "hit": "hit4",
          "formula": "(4.2 * atk * 1.05 + magicAdd) * crit(1|2) * GXP(1|1.2)",
          "release": "learned && mp && hurtRelease"
        }
      ],
      "actions": {
        "normal": {
          "hit": "hit1",
          "frameCount": 8,
          "emit": {
            "x": "direction * 100",
            "y": -40
          },
          "projectile": "PetMonkey3Bullet1"
        },
        "lyq": {
          "hit": "hit2",
          "frameCount": 2,
          "emit": {
            "x": "direction * 35",
            "y": -60
          },
          "projectile": "PetMonkey3Bullet2"
        },